<?xml version="1.0" encoding="UTF-8"?>
<schema xmlns="http://www.w3.org/2001/XMLSchema" targetNamespace="http://www.kth.se/Transcript"
	xmlns:tns="http://www.kth.se/Transcript" elementFormDefault="qualified">

	<!-- types -->
	<simpleType name="coolYear">
		<restriction base="gYear">
			<minInclusive value="1940"></minInclusive>
			<maxInclusive value="2014"></maxInclusive>
		</restriction>
	</simpleType>

	<!-- element definition -->
	<element name="university" type="string"></element>
	<element name="startYear" type="tns:coolYear"></element>
	<element name="endYear" type="tns:coolYear"></element>
	<element name="subject" type="string"></element>
	<element name="courseID" type="integer"></element>
	<element name="gradeVal">
		<simpleType>
			<restriction base="integer">
				<minInclusive value="5" />
				<maxInclusive value="10" />
			</restriction>
		</simpleType>
	</element>

	<!-- attribute definition -->



	<!-- complex type definition -->
	<element name="grades">
		<complexType>
			<sequence minOccurs="1" maxOccurs="unbounded">
				<element ref="tns:grade"></element>
			</sequence>
		</complexType>
	</element>

	<element name="grade">
		<complexType>
			<sequence>
				<element ref="tns:gradeVal"></element>
			</sequence>
			<attribute name="courseID" type="integer"></attribute>
		</complexType>
	</element>

	<element name="degree">
		<complexType>
			<sequence>
				<element ref="tns:university"></element>
				<element ref="tns:startYear"></element>
				<element ref="tns:endYear"></element>
				<element ref="tns:subject"></element>
				<element ref="tns:grades"></element>
			</sequence>
			<attribute name="title">
				<simpleType>
					<restriction base="string">
						<pattern value="MSc|Diploma|BSc"></pattern>
					</restriction>
				</simpleType>
			</attribute>
		</complexType>
	</element>

	<element name="degrees">
		<complexType>
			<sequence minOccurs="1" maxOccurs="unbounded">
				<element ref="tns:degree"></element>
			</sequence>
		</complexType>
	</element>

</schema>